{
  "response_id": "R_4Ka5vRl3NuBJ1Af",
  "question_key": "Question 40",
  "final_codes": {
    "codes": [
      {
        "actor": "A",
        "comparator": "More",
        "theme": "Information",
        "sub_theme": "Quality",
        "code": "In-depth",
        "reasoning": "The phrase 'broader in perspectives' suggests that GenAI provides more comprehensive and nuanced feedback, which aligns with the In-depth code that captures layered and expansive explanations."
      },
      {
        "actor": "T",
        "comparator": "More",
        "theme": "Information",
        "sub_theme": "Quality",
        "code": "Specificity",
        "reasoning": "The statement 'Feedbacks from teacher are personalized and more specific' directly indicates that teacher feedback is detailed and concrete, which matches the Specificity code."
      }
    ]
  },
  "iteration_results": [
    {
      "iteration_name": "Iteration1",
      "raw_response": "{\n    \"codes\": [\n        {   \n            \"actor\": \"A\",\n            \"comparator\": \"More\",\n            \"theme\": \"Information\",\n            \"sub_theme\": \"Quality\",\n            \"code\": \"In-depth\",\n            \"reasoning\": \"The phrase 'broader in perspectives' suggests that GenAI provides more comprehensive and nuanced feedback, which aligns with the In-depth code that captures layered and expansive explanations.\"\n        },\n        {   \n            \"actor\": \"T\",\n            \"comparator\": \"More\",\n            \"theme\": \"Information\",\n            \"sub_theme\": \"Quality\",\n            \"code\": \"Specificity\",\n            \"reasoning\": \"The statement 'Feedbacks from teacher are personalized and more specific' directly indicates that teacher feedback is detailed and concrete, which matches the Specificity code.\"\n        }\n    ]\n}",
      "timestamp": "2025-09-10T11:55:56.562799",
      "parsed_response": {
        "codes": [
          {
            "actor": "A",
            "comparator": "More",
            "theme": "Information",
            "sub_theme": "Quality",
            "code": "In-depth",
            "reasoning": "The phrase 'broader in perspectives' suggests that GenAI provides more comprehensive and nuanced feedback, which aligns with the In-depth code that captures layered and expansive explanations."
          },
          {
            "actor": "T",
            "comparator": "More",
            "theme": "Information",
            "sub_theme": "Quality",
            "code": "Specificity",
            "reasoning": "The statement 'Feedbacks from teacher are personalized and more specific' directly indicates that teacher feedback is detailed and concrete, which matches the Specificity code."
          }
        ]
      },
      "parse_error": ""
    },
    {
      "iteration_name": "Iteration2",
      "raw_response": "The provided output appears to be well-structured and aligns with the coding strategy. However, to ensure the response is complete and accurate, I will verify the reasoning and coding against the provided guidelines.\n\n### Verification:\n\n1. **First Code:**\n   - **Actor:** \"A\" (GenAI) is correctly identified as the actor.\n   - **Comparator:** \"More\" is appropriate since the student implies GenAI provides broader perspectives compared to teachers.\n   - **Theme:** \"Information\" is the correct theme as the feedback pertains to the quality of information provided.\n   - **Sub-theme:** \"Quality\" is accurate, and \"In-depth\" is the correct code because \"broader in perspectives\" suggests comprehensive and nuanced feedback.\n   - **Reasoning:** The reasoning is clear and directly tied to the student's statement.\n\n2. **Second Code:**\n   - **Actor:** \"T\" (Teacher) is correctly identified as the actor.\n   - **Comparator:** \"More\" is appropriate since the student explicitly states that teacher feedback is \"more specific.\"\n   - **Theme:** \"Information\" is the correct theme as the feedback pertains to the quality of information provided.\n   - **Sub-theme:** \"Quality\" is accurate, and \"Specificity\" is the correct code because the student describes teacher feedback as \"personalized and more specific.\"\n   - **Reasoning:** The reasoning is clear and directly tied to the student's statement.\n\n### Final Assessment:\nThe output is accurate and adheres to the coding strategy. No changes are needed.\n\n### Final Output:\n```json\n{\n    \"codes\": [\n        {   \n            \"actor\": \"A\",\n            \"comparator\": \"More\",\n            \"theme\": \"Information\",\n            \"sub_theme\": \"Quality\",\n            \"code\": \"In-depth\",\n            \"reasoning\": \"The phrase 'broader in perspectives' suggests that GenAI provides more comprehensive and nuanced feedback, which aligns with the In-depth code that captures layered and expansive explanations.\"\n        },\n        {   \n            \"actor\": \"T\",\n            \"comparator\": \"More\",\n            \"theme\": \"Information\",\n            \"sub_theme\": \"Quality\",\n            \"code\": \"Specificity\",\n            \"reasoning\": \"The statement 'Feedbacks from teacher are personalized and more specific' directly indicates that teacher feedback is detailed and concrete, which matches the Specificity code.\"\n        }\n    ]\n}\n```",
      "timestamp": "2025-09-10T11:56:02.748764",
      "parsed_response": {
        "codes": [
          {
            "actor": "A",
            "comparator": "More",
            "theme": "Information",
            "sub_theme": "Quality",
            "code": "In-depth",
            "reasoning": "The phrase 'broader in perspectives' suggests that GenAI provides more comprehensive and nuanced feedback, which aligns with the In-depth code that captures layered and expansive explanations."
          },
          {
            "actor": "T",
            "comparator": "More",
            "theme": "Information",
            "sub_theme": "Quality",
            "code": "Specificity",
            "reasoning": "The statement 'Feedbacks from teacher are personalized and more specific' directly indicates that teacher feedback is detailed and concrete, which matches the Specificity code."
          }
        ]
      },
      "parse_error": ""
    },
    {
      "iteration_name": "Iteration3",
      "raw_response": "The provided output is accurate and adheres to the coding strategy. It correctly identifies the actors, comparators, themes, sub-themes, and codes, and the reasoning is well-aligned with the student's response. No further changes are necessary.",
      "timestamp": "2025-09-10T11:56:06.773700",
      "parsed_response": null,
      "parse_error": "JSON parse error: Expecting value: line 1 column 1 (char 0)"
    }
  ],
  "researcher_feedback": {
    "agreement": true,
    "quality_score": 5,
    "feedback": "The final coding decision is accurate and aligns well with the framework. The reasoning provided for both codes is clear, logical, and directly tied to the student's response. The analysis is complete, and the coding strategy has been adhered to effectively. Additionally, the consistency across iterations supports the validity of the final decision.",
    "discrepancies": [],
    "recommendations": []
  },
  "agreement_metrics": {
    "iteration_agreement": {
      "agreement_score": 0.3333333333333333,
      "pairwise_agreements": [
        1.0,
        0.0,
        0.0
      ],
      "iteration_characteristics": [
        [
          "In-depth",
          "Specificity"
        ],
        [
          "In-depth",
          "Specificity"
        ],
        []
      ]
    },
    "timestamp": "2025-09-10T11:56:09.940753"
  },
  "conversation_history": [
    {
      "type": "HumanMessage",
      "content": "{\n    \"codes\": [\n        {   \n            \"actor\": \"A\",\n            \"comparator\": \"More\",\n            \"theme\": \"Information\",\n            \"sub_theme\": \"Quality\",\n            \"code\": \"In-depth\",\n            \"reasoning\": \"The phrase 'broader in perspectives' suggests that GenAI provides more comprehensive and nuanced feedback, which aligns with the In-depth code that captures layered and expansive explanations.\"\n        },\n        {   \n            \"actor\": \"T\",\n            \"comparator\": \"More\",\n            \"theme\": \"Information\",\n            \"sub_theme\": \"Quality\",\n            \"code\": \"Specificity\",\n            \"reasoning\": \"The statement 'Feedbacks from teacher are personalized and more specific' directly indicates that teacher feedback is detailed and concrete, which matches the Specificity code.\"\n        }\n    ]\n}"
    },
    {
      "type": "HumanMessage",
      "content": "The provided output appears to be well-structured and aligns with the coding strategy. However, to ensure the response is complete and accurate, I will verify the reasoning and coding against the provided guidelines.\n\n### Verification:\n\n1. **First Code:**\n   - **Actor:** \"A\" (GenAI) is correctly identified as the actor.\n   - **Comparator:** \"More\" is appropriate since the student implies GenAI provides broader perspectives compared to teachers.\n   - **Theme:** \"Information\" is the correct theme as the feedback pertains to the quality of information provided.\n   - **Sub-theme:** \"Quality\" is accurate, and \"In-depth\" is the correct code because \"broader in perspectives\" suggests comprehensive and nuanced feedback.\n   - **Reasoning:** The reasoning is clear and directly tied to the student's statement.\n\n2. **Second Code:**\n   - **Actor:** \"T\" (Teacher) is correctly identified as the actor.\n   - **Comparator:** \"More\" is appropriate since the student explicitly states that teacher feedback is \"more specific.\"\n   - **Theme:** \"Information\" is the correct theme as the feedback pertains to the quality of information provided.\n   - **Sub-theme:** \"Quality\" is accurate, and \"Specificity\" is the correct code because the student describes teacher feedback as \"personalized and more specific.\"\n   - **Reasoning:** The reasoning is clear and directly tied to the student's statement.\n\n### Final Assessment:\nThe output is accurate and adheres to the coding strategy. No changes are needed.\n\n### Final Output:\n```json\n{\n    \"codes\": [\n        {   \n            \"actor\": \"A\",\n            \"comparator\": \"More\",\n            \"theme\": \"Information\",\n            \"sub_theme\": \"Quality\",\n            \"code\": \"In-depth\",\n            \"reasoning\": \"The phrase 'broader in perspectives' suggests that GenAI provides more comprehensive and nuanced feedback, which aligns with the In-depth code that captures layered and expansive explanations.\"\n        },\n        {   \n            \"actor\": \"T\",\n            \"comparator\": \"More\",\n            \"theme\": \"Information\",\n            \"sub_theme\": \"Quality\",\n            \"code\": \"Specificity\",\n            \"reasoning\": \"The statement 'Feedbacks from teacher are personalized and more specific' directly indicates that teacher feedback is detailed and concrete, which matches the Specificity code.\"\n        }\n    ]\n}\n```"
    },
    {
      "type": "HumanMessage",
      "content": "The provided output is accurate and adheres to the coding strategy. It correctly identifies the actors, comparators, themes, sub-themes, and codes, and the reasoning is well-aligned with the student's response. No further changes are necessary."
    }
  ],
  "total_iterations": 1
}